{
  "meta": {
    "word": "存在主义",
    "options": {
      "speed": "fast",
      "depth": "intro",
      "scope": "point",
      "format": "html",
      "illustrations": true,
      "tone": "popular",
      "style": "plain",
      "citation_density": "low",
      "language": "zh"
    },
    "total_words": 8000,
    "generated_at": "2026-08-08T00:00:00Z"
  },
  "sections": [
    {
      "stage": 1,
      "title": "原初印象",
      "content": "存在主义首先是一句口号：存在先于本质。[1]",
      "word_count": 1300,
      "cached_terms": [
        {
          "term": "存在先于本质",
          "definition": "人先存在，再通过选择定义自身"
        }
      ]
    },
    {
      "stage": 2,
      "title": "时空坐标",
      "content": "克尔凯郭尔在 19 世纪写下《非此即彼》。[1]",
      "word_count": 1500,
      "cached_terms": []
    },
    {
      "stage": 3,
      "title": "核心要素拆解",
      "content": "自由、责任与自欺构成核心三角。[2]",
      "word_count": 1800,
      "cached_terms": []
    },
    {
      "stage": 4,
      "title": "深层机制",
      "content": "自由与责任互为条件。[3]",
      "word_count": 1200,
      "cached_terms": []
    },
    {
      "stage": 5,
      "title": "关联网络",
      "content": "存在主义与现象学互相缠绕。[4]",
      "word_count": 1100,
      "cached_terms": []
    },
    {
      "stage": 6,
      "title": "批判视角",
      "content": "结构主义提出批评。[5]",
      "word_count": 1100,
      "cached_terms": []
    }
  ],
  "transitions": [
    {
      "from_stage": 1,
      "to_stage": 2,
      "text": "这种思想是从哪里生长出来的？"
    },
    {
      "from_stage": 2,
      "to_stage": 3,
      "text": "它的核心主张是什么？"
    },
    {
      "from_stage": 3,
      "to_stage": 4,
      "text": "三个维度背后有无共同机制？"
    },
    {
      "from_stage": 4,
      "to_stage": 5,
      "text": "它在思想地图上处于什么位置？"
    },
    {
      "from_stage": 5,
      "to_stage": 6,
      "text": "它经得起哪些批判？"
    }
  ],
  "citations": [
    {
      "id": 1,
      "type": "encyclopedia",
      "title": "示例百科条目"
    },
    {
      "id": 2,
      "type": "academic",
      "title": "示例论文一"
    },
    {
      "id": 3,
      "type": "academic",
      "title": "示例论文二"
    },
    {
      "id": 4,
      "type": "deep_content",
      "title": "示例解读"
    },
    {
      "id": 5,
      "type": "official",
      "title": "示例机构报告"
    },
    {
      "id": 6,
      "type": "news",
      "title": "示例报道"
    }
  ],
  "statistics": {
    "total_words": 8000,
    "total_citations": 6,
    "unique_sources": 6,
    "avg_sentence_length": 20.0,
    "analogy_count": 2,
    "defined_terms_count": 3,
    "ai_pattern_score": 0.2
  }
}
