{
  "meta": {
    "word": "存在主义",
    "options": {
      "speed": "standard",
      "depth": "mid",
      "scope": "related",
      "format": "html",
      "illustrations": true,
      "tone": "academic",
      "citation_density": "standard",
      "language": "zh"
    },
    "total_words": 12000,
    "generated_at": "2026-08-08T00:00:00Z"
  },
  "sections": [
    {
      "stage": 1,
      "title": "原初印象",
      "content": "存在主义首先是一句口号：存在先于本质。[1]",
      "word_count": 1700,
      "cached_terms": [
        {
          "term": "存在先于本质",
          "definition": "人先存在，再通过选择定义自身"
        }
      ],
      "related_sidebar": ["虚无主义", "现象学"]
    },
    {
      "stage": 2,
      "title": "时空坐标",
      "content": "克尔凯郭尔在 19 世纪写下《非此即彼》。[1]",
      "word_count": 2200,
      "cached_terms": [],
      "related_sidebar": ["启蒙哲学", "两次世界大战"]
    },
    {
      "stage": 3,
      "title": "核心要素拆解",
      "content": "自由、责任与自欺构成核心三角。[2]",
      "word_count": 2600,
      "cached_terms": [],
      "related_sidebar": ["自欺", "自由意志"]
    },
    {
      "stage": 4,
      "title": "深层机制",
      "content": "自由与责任互为条件。[3]",
      "word_count": 2000,
      "cached_terms": [],
      "related_sidebar": ["责任伦理", "处境"]
    },
    {
      "stage": 5,
      "title": "关联网络",
      "content": "存在主义与现象学、结构主义互相缠绕。[4]",
      "word_count": 1900,
      "cached_terms": [],
      "related_sidebar": ["现象学", "结构主义", "后现代主义"]
    },
    {
      "stage": 6,
      "title": "批判视角",
      "content": "结构主义与实用主义分别提出批评。[5]",
      "word_count": 1600,
      "cached_terms": [],
      "related_sidebar": ["结构主义", "实用主义"]
    }
  ],
  "transitions": [
    { "from_stage": 1, "to_stage": 2, "text": "这种思想是从哪里生长出来的？" },
    { "from_stage": 2, "to_stage": 3, "text": "它的核心主张是什么？" },
    { "from_stage": 3, "to_stage": 4, "text": "三个维度背后有无共同机制？" },
    { "from_stage": 4, "to_stage": 5, "text": "它在思想地图上处于什么位置？" },
    { "from_stage": 5, "to_stage": 6, "text": "它经得起哪些批判？" }
  ],
  "citations": [
    { "id": 1, "type": "encyclopedia", "title": "示例百科条目" },
    { "id": 2, "type": "academic", "title": "示例论文一" },
    { "id": 3, "type": "academic", "title": "示例论文二" },
    { "id": 4, "type": "deep_content", "title": "示例解读" },
    { "id": 5, "type": "official", "title": "示例机构报告" },
    { "id": 6, "type": "news", "title": "示例报道" },
    { "id": 7, "type": "deep_content", "title": "示例书评" },
    { "id": 8, "type": "encyclopedia", "title": "示例词典" }
  ],
  "statistics": {
    "total_words": 12000,
    "total_citations": 8,
    "unique_sources": 8,
    "avg_sentence_length": 24.5,
    "analogy_count": 5,
    "defined_terms_count": 8,
    "ai_pattern_score": 0.12
  }
}
